{
  "analysis_release_id": "reliable_20260831_v3",
  "changed_reviews_since_prior_success": 4,
  "comparison_start_exclusive": "2026-08-29T19:32:32+00:00",
  "data_through": "2026-08-31T23:40:07+00:00",
  "human_review_queue_count": 0,
  "last_successful_run_at": "2026-08-31T23:40:07+00:00",
  "monitoring_run_id": "monitoring_20260831_reconcile_001",
  "new_reviews_since_prior_success": 6,
  "rating_mix": [
    {
      "count": 3,
      "denominator": 6,
      "rate_pct": 50.0,
      "rating": 1
    },
    {
      "count": 1,
      "denominator": 6,
      "rate_pct": 16.7,
      "rating": 3
    },
    {
      "count": 1,
      "denominator": 6,
      "rate_pct": 16.7,
      "rating": 4
    },
    {
      "count": 1,
      "denominator": 6,
      "rate_pct": 16.7,
      "rating": 5
    }
  ],
  "review_volume": [
    {
      "count": 3,
      "denominator": 6,
      "platform": "Android",
      "product": "Driver",
      "rate_pct": 50.0
    },
    {
      "count": 1,
      "denominator": 6,
      "platform": "iOS",
      "product": "Driver",
      "rate_pct": 16.7
    },
    {
      "count": 2,
      "denominator": 6,
      "platform": "iOS",
      "product": "Fleet",
      "rate_pct": 33.3
    }
  ],
  "schema_version": "1.0",
  "source_status": [
    {
      "app_key": "apple_driver_us",
      "newest_review_at": "2026-08-28T14:33:45+00:00",
      "observed_at": "2026-08-31T23:40:02+00:00",
      "records_received": 500,
      "status": "succeeded"
    },
    {
      "app_key": "apple_fleet_us",
      "newest_review_at": "2026-08-28T20:10:15+00:00",
      "observed_at": "2026-08-31T23:40:04+00:00",
      "records_received": 202,
      "status": "succeeded"
    },
    {
      "app_key": "google_driver_us",
      "newest_review_at": "2026-08-30T18:43:55+00:00",
      "observed_at": "2026-08-31T23:40:06+00:00",
      "records_received": 4280,
      "status": "succeeded"
    },
    {
      "app_key": "google_fleet_us",
      "newest_review_at": "2026-08-24T21:16:37+00:00",
      "observed_at": "2026-08-31T23:40:07+00:00",
      "records_received": 230,
      "status": "succeeded"
    }
  ]
}
